### ISSUE TITLE
UDP Multicast not showing

### ISSUE THREAD

**Issue by synologic** [firehol/netdata#1378]
Hello, very very nice tool here :)

But, i have a small problem regarding UDP Multicast packets not showing correctly. I have about 50 Mbit/s of MPEG-TS over UDP coming on one interface, and it shows correctly under the number of packets at IPv4 Networking -> Packets:
![image](https://cloud.githubusercontent.com/assets/10828699/21192574/5351e682-c229-11e6-9dd5-ccc97a325212.png)

However, udp shows 0:
![image](https://cloud.githubusercontent.com/assets/10828699/21192585/5c905b02-c229-11e6-9968-3a076a84d529.png)

Multicast too:
![image](https://cloud.githubusercontent.com/assets/10828699/21192591/62197586-c229-11e6-9127-e8596f7f1fe3.png)

Network interface shows the traffic:
![image](https://cloud.githubusercontent.com/assets/10828699/21192683/b0d6cfac-c229-11e6-8ea7-9b4fcdbed95f.png)

but the traffic is there (tcpdump):
19:11:04.381151 IP 10.32.247.33.49152 > 239.22.0.17.10017: UDP, length 1316
19:11:04.381162 IP 10.32.247.33.49152 > 239.22.0.9.10009: UDP, length 1316
19:11:04.381173 IP 10.32.247.33.49152 > 239.22.0.1.10001: UDP, length 1316
19:11:04.381233 IP 10.32.247.33.49152 > 239.22.0.14.10014: UDP, length 1316
19:11:04.381261 IP 10.32.247.33.49152 > 239.22.0.15.10015: UDP, length 1316
19:11:04.381280 IP 10.32.247.33.49152 > 239.22.0.12.10012: UDP, length 1316

Any suggestions ?

**Comment by ktsaou** [comment]
Hi, netdata reads `InMcastOctets` and `OutMcastOctets` from `/proc/net/netstat`: https://github.com/ktsaou/netdata/blob/3b8cfeecd6ee3d94452315a5bb6525ddea06caff/src/proc_net_netstat.c#L624-L625

You can find the current readings using these:

```sh
cat /proc/net/netstat | grep ^IpExt: | cut -d ' ' -f 10,11
```

This is incremental, so you have to run it again and again and find the incremental difference between each reading. If between runs the values are the same, netdata reports 0.

**Comment by ktsaou** [comment]
and, I do have such packets:

![image](https://cloud.githubusercontent.com/assets/2662304/21201296/26d11cde-c253-11e6-8f90-6efd5b60984c.png)

Which kernel version do you use?

**Comment by ktsaou** [comment]
Is it possible that MPEG-TS is `udplite`?

**Comment by l2isbad** [comment]
I have some MPEG-TS multicast too (**pass through** linux box ~ 22 mbit).
**ipv4.mcastpkts** and **ipv4.mcast** charts are ok.
And **ipv4.udppackets** is not for transit UDP i think.

**Comment by synologic** [comment]
Sorry, i posted in the morning but it seems it got lost :)
I found the "problem". The multicast i am receiving is in dense mode, so it's flooded to the interface. However at the time of me checking, there were no valid joins, so the multicast packets are silently dropped by the kernel, as there are nobody that needs them.

Once a valid join is made, the traffic shows in the multicast graphs.

**Comment by ktsaou** [comment]
ok. I am closing this.
